PERIOD,AUDITTYPE,STORECODE,DLRCODE,ITEMCODE,CATEGORY,MANUFACTURE,BRAND,ITEMDESC,MRP,PACKSIZE,PACKTYPE,COMMENTS,IMAGE
202501,1,119501114,92401010008,1737001440877,21,"BRIGHT LANKA PRODUCTS ",BRIGHT,BRIGHT/500/ML/PLBOT/CALCIUM REMOVER TILE CLEANER,360,500ML,PLBOT,,1737001440877-bright lanka products -bright#3.png
202501,1,120548131,21836010001,1737007673246,28,BRINTA ENTERPRISES (PVT) LTD,BRINTA,BRINTA/50/GM/PLPCH/JAFFNA CURRY POWDER,65,50G,PLPCH,New SKU,1737007673246-brinta enterprises -pvt- ltd-brinta#3.png
202501,1,120548131,21836010001,1737008552509,6,ORIENT LANKA CONFECTIONERY,MAAM NICE,MAAM/360/GM/PLPCH/NICE,370,360G,PLPCH,,1737008552509-orient lanka confectionery-maam nice#3.png
202501,1,16289556,51101010009,1736928850222,8,CEYLON BISCUITS LIMITED,"RITZBURY ","RITZBURY/90/G/PLUPCH/ROCCOA WITH CASHEW MILK ",430,90G,PLUPCH,,1736928850222-ceylon biscuits limited-ritzbury #3.png
202501,1,16289556,51101010009,1736929039667,8,CEYLON BISCUITS LIMITED,"RITZBURY ",RITZBURY/90/G/PLUPCH/ROCCOA/WITH  FRUIT & NUT,430,90G,PLUPCH,,1736929039667-ceylon biscuits limited-ritzbury #3.png
202501,1,134841321,21090010003,1737007620638,16,GREEN LANKA COSMETICS CO.,SUDUMAL,SUDUMA/160/GM/EWRPK/ DETERGENT BAR WHITE /GREEN LANKA COSMETICS CO.,80,160 GM,"EWRPK ",,1737007620638-green lanka cosmetics co--sudumal#3.png
202501,1,134841321,21090010003,1737007743136,16,GREEN LANKA COSMETICS CO.,SUDUMAL,SUDUMAL/160/GM/EWRPK /DETERGENT BAR ROSE/GREEN LANKA COSMETICS CO.,80,160 GM,"EWRPK ",,1737007743136-green lanka cosmetics co--sudumal#3.png
202501,2,116419657,11201020010,1736401322821,2,"CARGILLS FOOD & BEVERAGE LIMITED ",KIST SPARKLING ORANGE,"KIST SPARKLING ORANGE FLAVOURED DRINK/250ML/CAN ",180,250ML,CAN,,1737007743136-green lanka cosmetics co--sudumal#3.png
202501,1,72296297,15991010001,1737003925177,24,CEYLON AGRO INDUSTRIES,PRIMA TWIST,PRIMA TWIST / 400 / GM / PLPCH / NOODLES / SAVE / RS.30,260,400 GM,PLPCH,,1737003925177-ceylon agro industries-prima twist#3.png
202501,2,45914317,11201020016,1737029876841,2,MINDEE PRODUCTS,MINDEE,MINDEE LIME & GINGER DRINK/200ML/PLBOT,130,200ML,PLBOT,,1737029876841-mindee products-mindee#3.png
202501,2,111680758,21301020006,1737033211327,2,"AMARASA FOOD PRODUCTS ","COOL SHADOW ","AMARASA COOL SHADOW\200\ML\PLCU\ICE COFFEE ",60,200 ML,PLCUP,,1737033211327-amarasa food products -cool shadow #3.png
202501,1,116420174,17731010003,1737023541324,21,CEYLON LEISURE WERE PRODUCTS,HATTRICK,"HATTRICK/500/ML/PBT/NO-1/BATHROOM STAIN REMOVER TILE & TOILET CLEANER ",960,500ML,PBT,,1737023541324-ceylon leisure were products-hattrick#3.png
202501,2,137858399,52401020008,1737016308467,2,RIO FOODS & BEVERAGES (PVT) LTD,RIO,RIO/750/ML/PBT/NO--1/ COLA,180,750ML,PBT,,1737016308467-rio foods - beverages -pvt- ltd-rio#3.png
202501,2,137858399,52401020008,1737015843612,2,RIO FOODS & BEVERAGES (PVT) LTD,RIO,RIO/750/ML/PBT/NO-1/PRITE,180,750ML,PBT,,1737015843612-rio foods - beverages -pvt- ltd-rio#3.png
202501,2,137858399,52401020008,1737015570788,2,RIO FOODS & BEVERAGES (PVT) LTD,RIO,"RIO/750/ML/PBT /NO-1/GINGER ",180,750ML,PBT,,1737015570788-rio foods - beverages -pvt- ltd-rio#3.png
202501,4,112787654,19770040002,1737016247620,3,CARGILLS CONVENIENT FOODS,GOLDI,"GOLDI CHICKEN SAUSAGES CATERING PACK 450  FREE GOLDI CHICKEN MEATBALL 100GM ",210,450GM,PLPCH,,1737016247620-cargills convenient foods-goldi#3.png
202501,1,112787654,19770010002,1737005760148,13,NATURE'S BEAUTY CREATIONS LTD,"MISUMI ",MISUMI KIYO BEAUTY SOAP 65 GM,115,65GM,CDBOX,,1737005760148-nature-s beauty creations ltd-misumi #3.png
202501,1,112787654,19770010002,1737008307445,15,MFD BY TRADEX,CLENOL,CLENOL ACTIVE OXIGEN WASHING POWER 1000GM,450,1000GM,PLPCH,,1737008307445-mfd by tradex-clenol#3.png
202501,1,70045490,14400010001,1737003643795,39,DSL ENTERPRISES (PVT) LTD,SPEED,SPEED/40/GM/PBT/BINDER GLUE,90,40GM,PBT,,1737003643795-dsl enterprises -pvt- ltd-speed#3.png
202501,1,113828688,12208010004,1736914810236,19,UNILEVER SRI LANKA LTD,PEARS BABY,PEARS BABY/100/GM/PLBT/KOKUM BABY CREAM FOR MOISTURISED SKIN SAVE RS.40,330,100ML,PLBT,,1736914810236-unilever sri lanka ltd-pears baby#3.png
202501,1,8167083,20895010001,1736917491803,29,STAR HOLDINGS INTERNATIONAL,STAR LIGHT,STAR LIGHT/40/ML/PLPCH/POWER WASH LAUNDRY LIQUID LAVENDER,30,40ML,PLPCH,,1736914810236-unilever sri lanka ltd-pears baby#3.png
202501,2,116898274,71403020004,1737011080074,2,CEYLON COLD STORES,VIBE,VIBE/250/ML/CAN/APPLE BURST,150,250 ML,CAN,,1737011080074-ceylon cold stores-vibe#3.png
202501,2,116898274,71403020004,1737011197602,2,CEYLON COLD STORES,VIBE,VIBE/250/ML/CAN/GRAPE BURST,150,250 ML,CAN,,1737011197602-ceylon cold stores-vibe#3.png
202501,5,11210,123050002,1737002522429,36,RHD ENTERPRISES (PVT) LTD,RHD,RHD/0.5/INCH/PLPCH/PAINT BRUSH,250,0.5 INCH,"PLPCH ",,1737002522429-rhd enterprises -pvt- ltd-rhd#3.png
202501,1,102894520,14562010005,1736915078522,19,ACE HEALTHCARE PVT LTD,SWABHA CEYLON,SWABHA CEYLON/200/ML/PLBOT/NATURAL BRIGHTENING BODY LOTION LICORICE KARANDA,620,200 ML,"PLBOT ",,1736915078522-ace healthcare pvt ltd-swabha ceylon#3.png
202501,1,102894520,14562010005,1736918660584,19,UNILEVER SRI LANKA LTD,POND'S,POND'S/23/GM/CDBOX/BRIGHT BEAUTY SERUM CREAM NIACINAMIDE 98% PURE VITAMIN B3 + SAVE RS.90/-,590,23 GM,"CDBOX ",,1736918660584-unilever sri lanka ltd-pond-s#3.png
202501,1,102894520,14562010005,1736921622431,30,UNILEVER SRI LANKA LTD,PEARS BABY,PEARS/100/ML/CDBOX/MAGIC DROPS BABY COLOGNE + FREE PEARS/50/ML/PLBOT/BEDTIME BABY CREAM,575,100 ML,"CDBOX ",,1736921622431-unilever sri lanka ltd-pears baby#3.png
202501,1,118491341,32301010007,1736927812281,19,NATURE'S MIRACLE COSMATIC,CLASSIC WHITE,"CLASSIC WHITE ADVANCED/50G/CDBOX/REJUVENATING & BRIGHTENING NIGHT CREAM ",2850,"50G ","CDBOX ",,1736927812281-nature-s miracle cosmatic-classic white#3.png
202501,1,118491341,32301010007,1736844621674,13,UNILEVER SRI LANKA LTD,"LUX ",LUX/70G/EWPRK/SOFT GLOW VITAMIN C + E SAVE RS 15.00,110,"70G ","EWPRK ",,1736844621674-unilever sri lanka ltd-lux #3.png
202501,1,118491341,32301010007,1736845147241,13,HEMAS MARKETING,"BABY CHERAMY ","BABY CHERAMY/375G (75G ×5)/CDBOX/ALMOND OIL,VITAMIN E & MILK SAVE RS 45.00",680,375G (75×5),"CDBOX ",,1736845147241-hemas marketing-baby cheramy #3.png
202501,4,274961,11103040001,1736936155450,4,CARGILLS DAIRIES,MAGIC MANGO,MAGIC MANGO ICE CREAM 4000 ML PLTUB,2120,4000 ML,PLTUB,,1736936155450-cargills dairies-magic mango#3.png
202501,1,101929079,18782010001,1736921223310,6,CHERISH BISCUIT (PVT) LTD,CHERISH LEMON WAFERS,"CHERISH/30/GM/PLPCH/LEMON FLAVOURED ",50,30GM,PLPCH,,1736921223310-cherish biscuit -pvt- ltd-cherish lemon wafers#3.png
202501,1,101929079,18782010001,1736931078374,10,RUDIL PRODUCTS,RUDIL,RUDIL/ 70/GM/PLPCH/COUNTRY CHICKEN FLAVOURED  SOYA MEAT,140,70GM,PLPCH,,1736931078374-rudil products-rudil#3.png
202501,1,274650,11103010007,1736918582016,30,IMPORTED,RIIFFS MISS UNIVERSE,"RIIFFS MISS UNIVERSE EAU DE PARFUM NATURAL SPRAY VAPORISATCUR 100 ML CDBOX ",3900,100 ML,"CDBOX ",,1736918582016-imported-riiffs miss universe#3.png
202501,1,274650,11103010007,1736918751717,30,IMPORTED,RIIFFS MISS WORLD,"RIIFFS MISS WORLD EAU DE PARFUM NATURAL SPRAY VAPORISATCUR 100 ML CDBOX ",3900,100 ML,"CDBOX ",,1736918751717-imported-riiffs miss world#3.png
202501,1,274650,11103010007,1736917993249,30,IMPORTED,"RIIFFS HOT BLACK ",RIIFFS HOT BLACK EAU DE PARFUM NATURAL SPRAY VAPORISATCUR 100 ML CDBOX,3900,100 ML,"CDBOX ",,1736917993249-imported-riiffs hot black #3.png
202501,1,274650,11103010007,1736918257680,30,IMPORTED,RIIFFS EXPLORE BLUE,RIIFFS EXPLORE BLUE EAU DE PARFUM NATURAL SPRAY VAPORISATCUR 100 ML CDBOX,3900,100 ML,"CDBOX ",,1736918257680-imported-riiffs explore blue#3.png
202501,1,61368421,10404010003,1736931735116,30,C.B COSMETICS,ROMANTIC,ROMANTIC/50/ML/ROMANTIC POUR FEMME,950,50ML,CDBOX,New SKU,1736931735116-c-b cosmetics-romantic#3.png
202501,1,61368421,10404010003,1736920082983,26,IMPORTED,PANTENE PRO-V,PANTENE/200/ML/PLBOT/PANTENE PRO-V PERFECT CURLS SHAMPOO,1150,200ML,PLBOT,New SKU,1736920082983-imported-pantene pro-v#3.png
202501,1,8153507,13732010004,1736496425581,21,RECKITT BENCKISER (LANKA) LTD,HARPIC,HARPIC/500/ML/PBT/POWER PLUS 10X ADVANCED ORIGINAL/SAVE RS. 81/=,399,"500ML ",PBT,,1736920082983-imported-pantene pro-v#3.png
202501,5,12946,756050001,1736923501187,38,MAHAWELI HOLDING (PVT) LTD,MAHAWELI NC THINNER,"MAHAWELI SPECIAL/1000/ML/PLCAN/NC THINNER ",1420,1000ML,PLCAN,,1736923501187-mahaweli holding -pvt- ltd-mahaweli nc thinner#3.png
202501,5,12946,756050001,1736923572726,38,MAHAWELI HOLDING (PVT) LTD,MAHAWELI NC THINNER,"MAHAWELI SPECIAL/2000/ML/PLCAN/NC THINNER ",2990,2000ML,PLCAN,,1736923572726-mahaweli holding -pvt- ltd-mahaweli nc thinner#3.png
202501,1,16981241,17732010001,1736927897919,12,RUSBRO PRODUCTION & DISTRIBUTORS,RUSBRO,RUSBRO/250/GM/PURE THALAWAKELE FACTORY FRESH TEA,450,250 GM,PLPCH,,1736927897919-rusbro production - distributors-rusbro#3.png
202501,1,16981241,17732010001,1736928116283,12,RUSBRO PRODUCTION & DISTRIBUTORS,RUSBRO,RUSBRO/100/GM/PURE THALAWAKELE FACTORY FRESH TEA,180,100 GM,PLPCH,,1736928116283-rusbro production - distributors-rusbro#3.png
202501,1,16981241,17732010001,1736924660701,24,WIJITHA GROUP OF COMPANIES (PVT) LTD,WIJI,WIJI/250/GM/THIN STRING NOODLES  VERMICELLI STYLE,135,250 GM,PLPCH,,1736924660701-wijitha group of companies -pvt- ltd-wiji#3.png
202501,1,16981241,17732010001,1736925558652,28,SENKADAGALA PRODUCTS (PVT) LTD,SENKADAGALA,SENKADAGALA/100/GM/CHILLI FLAKES,160,100 GM,PLPCH,,1736925558652-senkadagala products -pvt- ltd-senkadagala#3.png
202501,1,16981241,17732010001,1736925324947,28,SENKADAGALA PRODUCTS (PVT) LTD,SENKADAGALA,SENKADAGALA/100/GM/SPECIAL ROASTED BLACK CURRY POWDER,175,100 GM,PLPCH,,1736925324947-senkadagala products -pvt- ltd-senkadagala#3.png
202501,5,12475,21050002,1736932260105,36,R.F MARKETING SERVICE PVT LTD,STR,"STR\1NO\3""(75MM)\PAINT BRUSH ",700,"3""(75MM)",NO,,1736932260105-r-f marketing service pvt ltd-str#3.png
202501,5,12475,21050002,1736931801533,36,R.F MARKETING SERVICE PVT LTD,STR,"STR\1NO\1/2""(12MM)\PAINT BRUSH ",270,"1/2""(25 MM)",NO,,1736931801533-r-f marketing service pvt ltd-str#3.png
202501,5,12475,21050002,1736931925325,36,R.F MARKETING SERVICE PVT LTD,STR,"STR\1NO\1 1/2""(37MM)\PAINT BRUSH.",390,"1/2""(25 MM)",NO,,1736931925325-r-f marketing service pvt ltd-str#3.png
202501,5,12475,21050002,1736931518243,36,R.F MARKETING SERVICE PVT LTD,STR,"STR\1 NO\1""(25MM)\PAINT BRUSH ",330,"1""(25 MM)",NO,,1736931518243-r-f marketing service pvt ltd-str#3.png
202501,5,12475,21050002,1736932377956,36,R.F MARKETING SERVICE PVT LTD,STR,"STR\1NO\4""\PAINT BRUSH ",950,"4""",NO,,1736932377956-r-f marketing service pvt ltd-str#3.png
202501,5,12475,21050002,1736932160245,36,R.F MARKETING SERVICE PVT LTD,STR,"STR\1NO\2 1/2""(63MM)\PAINT ",600,"2 1/2"" (63 MM)",NO,,1736932160245-r-f marketing service pvt ltd-str#3.png
202501,5,12475,21050002,1736932037597,36,R.F MARKETING SERVICE PVT LTD,STR,"STR\1NO\2""(50MM)\PAINT BRUSH ",495,"2""(50MM)",NO,,1736932037597-r-f marketing service pvt ltd-str#3.png
202501,5,12475,21050002,1736932569984,36,R.F MARKETING SERVICE PVT LTD,STR,"STR\1NO\5""\PAINT BRUSH ",1150,"5""",NO,,1736932569984-r-f marketing service pvt ltd-str#3.png
202501,1,45914331,13401010002,1736915780266,19,UNILEVER SRI LANKA LTD,"FAIR & LOVELY & GLOW & HANDSOME ",FAIR & LOVELY GLOW & HANDSOME \50\G\CD BOX\ INSTANT BRIGHTNESS RAPID ACTION CREAM +FREE AXE TICKET DEODORANT 17 ML,1055,50G,CD BOX,,1736915780266-unilever sri lanka ltd-fair - lovely - glow - handsome #3.png
202501,1,45914331,13401010002,1736918538349,19,UNILEVER SRI LANKA LTD,VASELINE,VASELINE \200\ML\PBT\HEALTHY BRIGHT IN 2 WEEKS NIACINAMIDE VITAMIN B3 SERUM IN LOTION SAVE R.S 265,900,200ML,PBT,,1736918538349-unilever sri lanka ltd-vaseline#3.png
202501,1,45914331,13401010002,1736918878259,19,UNILEVER SRI LANKA LTD,VASELINE,VASELINE \200\ML\PBT\ WITH NATURAL ALOE EXTRACT SERUM IN LOTION SAVE R.S 140,820,200ML,PBT,,1736918878259-unilever sri lanka ltd-vaseline#3.png
202501,1,45914331,13401010002,1736923832375,8,STASSEN FOODS PVT LTD,BOUNTY,BOUNTY\57\G\EWRPK \CHOCOLATE BAR,390,57G,"EWRPK ",,1736923832375-stassen foods pvt ltd-bounty#3.png
202501,1,45914331,13401010002,1736920504420,23,HEMAS PHARMACEUTICALS (PVT) LTD,SUSTAGEN JUNIOR,SUSTAGEN JUNIOR \400\G\TIN\VANILLA FLAVOUR NUTRITIONAL SUPPLEMENT 6-11 YEAR OLD. SAVE R.S 300,2450,400G,TIN,,1736920504420-hemas pharmaceuticals -pvt- ltd-sustagen junior#3.png
202501,5,10166,27050002,1736921700648,36,OMEGA PAINT BRUSHES,OMEGA,"OMEGA/NO-1/4""/EWRPK /PAINT BRUSH",800,"4""","EWRPK ",,1736921700648-omega paint brushes-omega#3.png
202501,1,119981440,20896010001,1736917491803,29,STAR HOLDINGS INTERNATIONAL,STAR LIGHT,STAR LIGHT/40/ML/PLPCH/POWER WASH LAUNDRY LIQUID LAVENDER,30,40ML,PLPCH,,1736917491803-star holdings international-star light#3.png
202501,1,119981440,20896010001,1736923906183,29,STAR HOLDINGS INTERNATIONAL,STAR LIGHT,STAR LIGHT/40/ML/PLPCH/POWER WASH LAUNDRY LIQUID ARALIYA,30,40ML,PLPCH,,1736923906183-star holdings international-star light#3.png
202501,1,41095157,22402010013,1736948257581,19,IMPORTED,"FAIR & LOVELY ","FAIR & LOVELY/4.5 GM/PLPCH/GLOW & LOVELY ADVANCED MULTI VITAMIN ",60,4.5 GM,PLPCH,,1736948257581-imported-fair - lovely #3.png
202501,1,41095157,22402010013,1736947806609,30,IMPORTED,AL-ALIM,LACOSTE/6 ML/CD BOX/AL-ALIM,550,6 ML,CD BOX,,1736947806609-imported-al-alim#3.png
202501,1,41095157,22402010013,1736947631884,30,IMPORTED,AL-ALIM,REAL MIRAGE/6 ML/CD BOX/AL-ALIM,550,6 ML,CD BOX,,1736947631884-imported-al-alim#3.png
202501,1,41095157,22402010013,1736947438760,30,IMPORTED,CROWN,BRUT/6 ML/CD BOX/CROWN PERFUMES,420,6 ML,CD BOX,,1736947438760-imported-crown#3.png
202501,1,558036,15868010001,1736921440894,17,SASIKA FOOD PRODUCTS,SASIKA,SASIKA / 200 / ML / PLBOT / DRINKING YOGHUT,140,200 ML,PLBOT,,1736921440894-sasika food products-sasika#3.png
202501,1,8155475,32401010002,1736936130817,24,NESTLE LANKA,MAGGI,"MAGGI/75/GM/PLPCH/PAPARE BLAST NOODLES ",120,"75GM ","PLPCH ",,1736936130817-nestle lanka-maggi#3.png
202501,1,135836247,62402010013,1736930586789,33,IMPORTED,LANISS,"LANISS/60/ML/CDBOX/BRIGHT LIGHT COFFEE BLONDE ",895,60 ML,CDBOX,,1736930586789-imported-laniss#3.png
202501,1,135836247,62402010013,1736928284991,19,UNILEVER SRI LANKA LTD,FAIR & LOVELY,"FAIR & LOVELY/25/GM/CDBOX/GLOW & LOVELY POWDER FINISH WITH MULTI VITAMINS + BRIGHTENING POWDER ",465,25 GM,CDBOX,,1736928284991-unilever sri lanka ltd-fair - lovely#3.png
202501,1,17854397,20291010001,1736924536434,28,WELLASSA PRODUCTS (PVT) LTD,"WELLASSA ","WELLASSA /500G/POCH PACK /CHILI POWDER ",650,500G,"POCH ",,1736924536434-wellassa products -pvt- ltd-wellassa #3.png
202501,1,793144,19824010001,1736918419800,21,CLEAN MAX,CLEAN MAX,CLEAN MAX/250/ML/PLBOT/TOILET BOWL CLEANER,260,250ML,"PLBOT ",,1736918419800-clean max-clean max#3.png
202501,2,135836181,62402020005,1736921551900,2,"CARGILLS FOOD & BEVERAGE LIMITED ",KIST,KIST/250/ML/CAN/SPARKLING GREEN APPLE FLAVOURED DRINK,180,250 ML,CAN,,1736921551900-cargills food - beverage limited -kist#3.png
202501,2,135836181,62402020005,1736921403067,2,"CARGILLS FOOD & BEVERAGE LIMITED ",KIST,KIST/250/ML/CAN/SPARKLING STRAWBERRY FLAVOURED DRINK,180,250 ML,CAN,,1736921403067-cargills food - beverage limited -kist#3.png
202501,2,135836181,62402020005,1736921849381,2,"CARGILLS FOOD & BEVERAGE LIMITED ",KIST,KIST/250/ML/CAN/ORANGE FLAVOURED DRINI,180,250 ML,CAN,,1736921849381-cargills food - beverage limited -kist#3.png
202501,2,8164195,20307020002,1736919829160,2,TOP BEVERAGES PVT LTD,TOP TGB,"TOP/330/ML/PET/TGB ",100,330ML,PET,,1736919829160-top beverages pvt ltd-top tgb#3.png
202501,1,70489369,10388010001,1736575120677,6,MALIBAN BISCUIT MANUFACTORIES,"MALIBAN ",MALIBAN/490/GM/PL POUCH/ CREAM CRACKER FAMILY PACK+SEASONAL OFFER RS 60 OFF,420,490 GM,PL POUCH,,1736919829160-top beverages pvt ltd-top tgb#3.png
202501,1,112787385,13722010001,1736837440352,24,NESTLE LANKA,MAGGI HOT,MAGGI/75/GM/PLPCH/PAPARE BLAST,120,"75GM ","PLPCH ",,1736837440352-nestle lanka-maggi hot#3.png
202501,1,112787385,13722010001,1736498435295,13,GODAKANDA HERBALS (PVT) LTD - (VENDOL LANKA),VENDOL VOLIN,VENDOL VOLIN/80/GM/CDB/ORIGINAL GOLD/SAVE RS. 25/=,100,"80GM ",CDB,,1736498435295-godakanda herbals -pvt- ltd - -vendol lanka--vendol volin#3.png
202501,1,112787385,13722010001,1736496425581,21,RECKITT BENCKISER (LANKA) LTD,HARPIC,HARPIC/500/ML/PBT/POWER PLUS 10X ADVANCED ORIGINAL/SAVE RS. 81/=,399,"500ML ",PBT,,1736496425581-reckitt benckiser -lanka- ltd-harpic#3.png
202501,1,112787385,13722010001,1736498570261,13,GODAKANDA HERBALS (PVT) LTD - (VENDOL LANKA),VENDOL VOLIN,VENDOL VOLIN/80/GM/CDB/ORIGINAL PINK SECRET BEAUTY OIL WITH KUMKUMADI/SAVE RS. 25/=,100,"80GM ",CDB,,1736498570261-godakanda herbals -pvt- ltd - -vendol lanka--vendol volin#3.png
202501,1,112787385,13722010001,1736498327438,13,GODAKANDA HERBALS (PVT) LTD - (VENDOL LANKA),VENDOL VOLIN,VENDOL VOLIN/80/GM/CDB/ORIGINAL CARROT WITH TURMERIC/SAVE RS. 25/=,100,"80GM ",CDB,,1736498327438-godakanda herbals -pvt- ltd - -vendol lanka--vendol volin#3.png
202501,2,793515,71402020003,1736592546306,2,CEYLON COLD STORES,ELEPHANT VIBE,ELEPHANT VIBE/250/ML/PBT/APPLE BURST,150,250ML,CAN,,1736592546306-ceylon cold stores-elephant vibe#3.png
202501,2,793515,71402020003,1736592330599,2,CEYLON COLD STORES,ELEPHANT VIBE,ELEPHANT VIBE/250/ML/CAN/ORANGE BURST,150,250ML,CAN,,1736592330599-ceylon cold stores-elephant vibe#3.png
202501,2,793515,71402020003,1736592174127,2,CEYLON COLD STORES,ELEPHANT VIBE,ELEPHANT VIBE/250/ML/CAN/ GRAPE BURST,150,250ML,CAN,,1736592174127-ceylon cold stores-elephant vibe#3.png
202501,1,8151517,21407010008,1736830885740,12,TEA & SPICE HOUSE,LAK KAHATA,LAK KHATA\100\G\POUCH \BOPF,190,100G,"POUCH ",,1736830885740-tea - spice house-lak kahata#3.png
202501,1,8151517,21407010008,1736830767837,12,TEA & SPICE HOUSE,LAK KAHATA,LAK KAHATA\200\G\POUCH\BOPF,375,200G,"POUCH ",,1736830767837-tea - spice house-lak kahata#3.png
202501,1,8151517,21407010008,1736830991576,12,TEA & SPICE HOUSE,LAK KAHATA,LAK KAHATA\50\G\POUCH\BOPF,95,50G,"POUCH ",,1736830991576-tea - spice house-lak kahata#3.png
202501,1,8151517,21407010008,1736833825528,6,MALIBAN BISCUIT MANUFACTORIES,"MALIBAN CREAM CRACKER ",MALIBAN\490\G\PLPCH \CREAM CRACKER FAMILY PACK SAVE R.S 60,420,490G,"PLPCH ",,1736833825528-maliban biscuit manufactories-maliban cream cracker #3.png
202501,1,118265472,14380010001,1736830900647,28,DINARA ENTERPRISES,DINARA,DINARA/1000/GM/PLPCH/ROASTED CURRY POWDER/DINARA ENTERPRISES,1340,1000 GM,"PLPCH ",,1736830900647-dinara enterprises-dinara#3.png
202501,1,277243,52401010008,1736836765399,12,INGURUGALA TEA FACTORY,"INGURUGALA ",INGURUGALA/50/GM/TEA/PLPCH,90,50GM,PLPCH,,1736836765399-ingurugala tea factory-ingurugala #3.png
202501,1,793362,20568010002,1736242909296,28,"GALAUDA GRINDING ",G G PRODUCTS,"G G PRODUCTS/50/GM/PLPCH/TURMERIC POWDER ",260,50GM,PLPCH,,1736836765399-ingurugala tea factory-ingurugala #3.png
202501,1,8166239,72407010009,1736830565604,30,N,LADY,LADY /80ML/BOX/MILLIC/LUCY/,4195,80ML,BOX,,1736830565604-n-lady#3.png
202501,2,131545863,81201020003,1736741602988,2,NNR DISTRIBUTORS,NNR APPLE,"NNR/180/ML/PLCUP/APPLE DRINK ",50,180ML,PLCUP,,1736741602988-nnr distributors-nnr apple#3.png
202501,2,131545863,81201020003,1736741807368,2,NNR DISTRIBUTORS,"NNR MIXED FRUIT ",NNR/180/ML/PLCUP/MIXED FRUIT DRINK,50,180ML,PLCUP,,1736741807368-nnr distributors-nnr mixed fruit #3.png
202501,1,118491246,14119010001,1736754605613,28,SURALA PRODUCTS,SURALA,"SURALA/50/GM/PLPCH/TURMERIC POWDER ",250,"50GM ","PLPCH ",,1736754605613-surala products-surala#3.png
202501,1,118491246,14119010001,1736754629594,28,SURALA PRODUCTS,SURALA,"SURALA/25/GM/PLPCH/TURMERIC POWDER ",130,"25GM ","PLPCH ",,1736754629594-surala products-surala#3.png
202501,1,8168386,81302010002,1736746239713,21,WIC,WIC,"WIC/500/ML/PLBOT/LEMON DISHWASH LIQUID ",350,500ML,"PLBOT ",,1736746239713-wic-wic#3.png
202501,1,8168386,81302010002,1736747680925,6,CEYLON BISCUITS LIMITED,"MUNCHEE ",MUNCHEE/360/GM/PLPCH/TIKIRI MARIE BISCUITS/OFFER PRICE 30,300,360GM,"PLPCH ",,1736747680925-ceylon biscuits limited-munchee #3.png
202501,1,8168386,81302010002,1736749915588,9,MALIBAN MILK PRODUCT (PVT) LTD,MALIBAN,MALIBAN/200/GM/CDBOX/FULL CREAM MILK POWDER/SAVE RS 20,520,"200GM ","CDBOX ",,1736749915588-maliban milk product -pvt- ltd-maliban#3.png
202501,1,131555054,13771010005,1736502951160,30,UNILEVER SRI LANKA LTD,PEARS BABY,"PEARS/100/ML/CDBOX/MAGIC DROPS BABY COLOGNE + FREE PEARS/50/ML/PLBOT/BEDTIME BABY CREAM ",575,100ML,"CDBOX ",,1736502951160-unilever sri lanka ltd-pears baby#3.png
202501,1,131555054,13771010005,1736503663032,19,UTN TRADING,ENCHANTEUR,"ENCHANTEUR/100/ML/PLBOT/ALLURING VISIBLY RADIANT SKIN VITAMIN A,C,E & NIACINAMIDE",790,100ML,"PLBOT ",,1736503663032-utn trading-enchanteur#3.png
202501,1,116420711,19852010001,1736584130052,6,MALIBAN BISCUIT MANUFACTORIES,"MALIBAN ",MALIBAN/490/G/PLPCH/CREAM CRACKER SAVE 60,420,490G,"PLPCH ",,1736584130052-maliban biscuit manufactories-maliban #3.png
202501,1,69800410,14344010001,1736663170628,28,HIMALI STORES,HIMALI,HIMALI/1000/GM/PLPCH/CHILLI POWDER/HIMALI STORES,1300,1000 GM,"PLPCH ",,1736663170628-himali stores-himali#3.png
202501,2,41381036,13101020006,1736669538985,5,AUTUMN WATER BOTTLED PVT LTD,AUTUMN,"AUTUMN\500\ML\PBT\BOTTLED DRINKING WATER ",100,500ML,PBT,,1736669538985-autumn water bottled pvt ltd-autumn#3.png
202501,2,41381036,13101020006,1736669737405,2,REEM BEVERAGE,REEM MANGO,"REEM\1\L\PBT\MANGO NECTAR ",400,1L,PBT,,1736669737405-reem beverage-reem mango#3.png
202501,2,60993302,10227020001,1736672287446,2,WEERASINHA HOLDING (PVT) LTD,WINDAY,WINDAY/200/ML/GLBT/GINGER BEER,140,200ML,GLBT,Invoices not available,1736672287446-weerasinha holding -pvt- ltd-winday#3.png
202501,2,118490873,11107020030,1736571406872,2,CEYLON COLD STORES,VIBE,VIBE /250ML/CAN/GRAPE BURST,150,250ML,CAN,,1736571406872-ceylon cold stores-vibe#3.png
202501,1,113828214,10394010001,1736575120677,6,MALIBAN BISCUIT MANUFACTORIES,"MALIBAN ",MALIBAN/490/GM/PL POUCH/ CREAM CRACKER FAMILY PACK+SEASONAL OFFER RS 60 OFF,420,490 GM,PL POUCH,,1736575120677-maliban biscuit manufactories-maliban #3.png
202501,1,46613750,61404010002,1736580326502,17,NAWODA NUWANGI ENTERPRISE,THEPULIE,"THEPULIE/80/GM/CUP/FRUIT JELLY YOGHURT ",70,80GM,CUP,,1736580326502-nawoda nuwangi enterprise-thepulie#3.png
202501,1,46613750,61404010002,1736578698740,28,MOUNI PRODUCTS PVT LTD,"MOUNI PRODUCTS ","MOUNI PRODUCTS/50/GM/PLPCH/TURMERIC POWDER ",250,50GM,PLPCH,Last month stock  counting error,1736578698740-mouni products pvt ltd-mouni products #3.png
202501,1,46613750,61404010002,1736580080297,17,"THEPULI MILK PRODUCTS ",THEPULIE,"THEPULIE/80/GM/CUP/SET YOGHURT ",70,80GM,CUP,,1736580080297-thepuli milk products -thepulie#3.png
202501,2,57914731,12103020012,1736575902566,5,BLUETWO (PRIVATE) LIMITED,NEO,NEO/1000/ML/PBT/BOTTLED DRINKING WATER,130,1000/ML,PBT,,1736575902566-bluetwo -private- limited-neo#3.png
202501,2,57914731,12103020012,1736575681635,5,BLUETWO (PRIVATE) LIMITED,NEO,NEO/500/ML/PBT/BOTTLED DRINKING WATER,90,500/ML,PBT,,1736575681635-bluetwo -private- limited-neo#3.png
202501,4,133672025,21818040001,1736578836212,4,JANAN ICE CREAM,"JANAN VANILLA ","JANAN/80/ML/PLCUP/VANILLA ICE CREAM ",60,80ML,PLCUP,,1736578836212-janan ice cream-janan vanilla #3.png
202501,2,133669745,13763020001,1736580132295,2,"CARGILLS FOOD & BEVERAGES LIMITED ","KIST ",KIST ORANGE/250/ML/CAN/SPARKLING FLAVOURED DRINK,180,"250ML ",CAN,,1736580132295-cargills food - beverages limited -kist #3.png
202501,2,133669745,13763020001,1736579755757,2,"CARGILLS FOOD & BEVERAGES LIMITED ","KIST GREEN APPLE ",KIST GREEN APPLE/250/ML/CAN,180,"250ML ",CAN,,1736579755757-cargills food - beverages limited -kist green apple #3.png
202501,2,133669745,13763020001,1736580067705,2,"CARGILLS FOOD & BEVERAGES LIMITED ","KIST ",KIST STRAWBERRY/250/ML/CAN/SPARKLING FLAVOURED DRINK,180,"250ML ",CAN,,1736580067705-cargills food - beverages limited -kist #3.png
202501,1,38030356,21101010007,1736569424880,19,C.W. MACKIE PLC,HIMALAYA,"HIMALAYA/50/ML/CDBOX/REVITALIZING NIGHTCREAM ",1535,50ML,"CDBOX ",,1736569424880-c-w- mackie plc-himalaya#3.png
202501,1,38030356,21101010007,1736568969267,19,C.W. MACKIE PLC,HIMALAYA,"HIMALAYA/50/ML/PLTUB/NOURISHING SKIN CREAM,LIGHT & NON - GREASY",810,50ML,"PLTUB ",,1736568969267-c-w- mackie plc-himalaya#3.png
202501,1,39073924,51304010009,1736569240398,28,SAMAN FOODS PVT LTD,SAMAN,SAMAN/50/GM/CHILLI PIECES,75,50 GM,PLPCH,,1736569240398-saman foods pvt ltd-saman#3.png
202501,1,89865873,14501010001,1736584791499,24,LAKMEE EXPORTS,LAKMEE,LAKMEE/400/GM/PLPCH/NOODLES +LAKMEE CHILLI AND GARLIC SAUCE 75ML FREE,300,"400GM ","PLPCH ",,1736584791499-lakmee exports-lakmee#3.png
202501,2,135836401,62402020004,1736582953556,5,SPRING FOOD (PVT) LTD,KINGS WATER,"KINGS WATER/1500/ML/PBT/BOTTLED DRINKING WATER ",160,1500 ML,PBT,,1736582953556-spring food -pvt- ltd-kings water#3.png
202501,2,38087544,51101020041,1736312756964,2,CEYLON COLD STORES,ELEPHANT HOUSE,ELEPHANT HOUSE VIBE/250/ML/TIN/APPLE BURST,150,250 ML,TIN,,1736582953556-spring food -pvt- ltd-kings water#3.png
202501,2,38087544,51101020041,1736312914520,2,CEYLON COLD STORES,ELEPHANT HOUSE,"ELEPHANT HOUSE VIBE/250/ML/TIN/GRAPE BURST ",150,250 ML,TIN,,1736582953556-spring food -pvt- ltd-kings water#3.png
202501,2,61092078,10227020003,1736579956419,2,WEERASINHA HOLDING (PVT) LTD,WINDAY,WINDAY/200/ML/GLBT/NATURAL TAMARIND DRINK,150,200ML,GLBT,Invoices not available,1736579956419-weerasinha holding -pvt- ltd-winday#3.png
202501,2,61092078,10227020003,1736580132750,2,WEERASINHA HOLDING (PVT) LTD,WINDAY,WINDAY/200/ML/GLBT/NATURAL WOOD APPLE DRINK,150,200ML,GLBT,Invoices not available,1736580132750-weerasinha holding -pvt- ltd-winday#3.png
202501,2,61092078,10227020003,1736577962126,2,WEERASINHA HOLDING (PVT) LTD,WINDAY,WINDAY/200/ML/GLBT/NATURAL LIME & GINGER DRINK,150,200ML,GLBT,Invoices not available,1736577962126-weerasinha holding -pvt- ltd-winday#3.png
