PERIOD,AUDITTYPE,STORECODE,DLRCODE,ITEMCODE,CATEGORY,MANUFACTURE,BRAND,ITEMDESC,MRP,PACKSIZE,PACKTYPE,COMMENTS,IMAGE
202501,1,72562992,17489010001,1737801497302,10,MAGAM LIFE (PVT) LTD,MAGAM,"MAGAM/60/GM/PLPCH/PRAWNS FLAVOUR ",100,60 GM,"PLPCH ",,1737801497302-magam life -pvt- ltd-magam#3.png
202501,1,72562992,17489010001,1737801736081,10,"GAMI RASA FOOD PRODUCTS ( PVC ) LTD ","GAMIRASA ","GAMIRASA/40/GM/PLPCH/BUCKET PACK ",60,40 GM,"PLPCH ",,1737801736081-gami rasa food products - pvc - ltd -gamirasa #3.png
202501,2,321371,18154020002,1737799014355,2,CEYLON COLD STORES,ELEPHANT VIBE,ELEPHANT/250/ML/VIBE/ORANGE BURST,150,250 ML,CAN,,1737799014355-ceylon cold stores-elephant vibe#3.png
202501,2,321371,18154020002,1737798751513,2,CEYLON COLD STORES,ELEPHANT VIBE,ELEPHANT/250/ML/VIBE/GRAPE BURST,150,250 ML,CAN,,1737798751513-ceylon cold stores-elephant vibe#3.png
202501,5,12510,54050004,1737526593566,38,S & C HARDWARE DISTRIBUTOR,S & C NC THINNER,"S & C \4\L\PL CAN\ NC THINNER ",4990,4L,PL CAN,,1737526593566-s - c hardware distributor-s - c nc thinner#3.png
202501,5,12510,54050004,1737526664743,38,S & C HARDWARE DISTRIBUTOR,S & C NC THINNER,"S & C\4\L\PL CAN\NC THINNER ",0,4L,PL CAN,Any other reason,1737526664743-s - c hardware distributor-s - c nc thinner#3.png
202501,5,12510,54050004,1737526474215,38,S & C HARDWARE DISTRIBUTOR,S & C NC THINNER,"S & C \2\L\PL CAN\NC THINNER ",2740,2L,PL CAN,,1737526474215-s - c hardware distributor-s - c nc thinner#3.png
202501,5,12517,54050002,1737800374991,38,LUCKY DISTRIBUTORS,DELTA,"DELTA\4\L\PL CAN\WOOD PRESERVATIVE CLEAR ",3295,4L,PL CAN,,1737800374991-lucky distributors-delta#3.png
202501,5,12517,54050002,1737800218802,38,LUCKY DISTRIBUTORS,DELTA,"DELTA\2\L\PL CAN\WOOD PRESERVATIVE CLEAR ",1875,2L,PL CAN,,1737800218802-lucky distributors-delta#3.png
202501,1,131555317,14403010001,1737781886336,7,GREEN LIGHT BAKE HOUSE,GREEN LIGHT,"GREEN LIGHT/450/GM/ CDBOX/CREAMY ICING  CAKE ",800,450GM,"CDBOX ",,1737781886336-green light bake house-green light#3.png
202501,1,131555317,14403010001,1737781709302,7,GREEN LIGHT BAKE HOUSE,GREEN LIGHT,"GREEN LIGHT/220/GM/CDBOX/BUTTER CAKE ",430,220GM,"CDBOX ",,1737781709302-green light bake house-green light#3.png
202501,1,131555317,14403010001,1737781765285,7,GREEN LIGHT BAKE HOUSE,GREEN LIGHT,"GREEN LIGHT/220/GM/CDBOX/FRUIT CAKE ",460,220GM,"CDBOX ",,1737781765285-green light bake house-green light#3.png
202501,1,8144279,10664010001,1737614362496,24,NESTLE LANKA,MAGGI PAPARE,"MAGGI/75/GM/PLPCH/MAGGI PAPARE BLAST INSTANT NOODLES ",120,75GM,PLPCH,New SKU,1737614362496-nestle lanka-maggi papare#3.png
202501,4,87340527,62403040002,1737796573676,4,THE COLOMBO ICE COMPANY (PVT)LTD,"ELEPHANT HOUSE ",ELEPHANT HOUSE TAMARIND & HONEY 60ML,0,60ML,PLPCH,Delete the Item,1737796573676-the colombo ice company -pvt-ltd-elephant house #3.png
202501,4,87340527,62403040002,1737796618599,4,THE COLOMBO ICE COMPANY (PVT)LTD,"ELEPHANT HOUSE ",ELEPHANT HOUSE TAMARIND & HONEY POPSICLE 60ML,60,60ML,PLPCH,,1737796618599-the colombo ice company -pvt-ltd-elephant house #3.png
202501,1,135836240,62402010009,1737796234797,11,SUNSHINE COUNSUMER LANKA LTD,X-TRA,X-TRA/1/NO/PLPCH/FRESH STRAWBERRY CENTER FILLED BUBBLE GUM,10,1 NO,PLPCH,New SKU,1737796234797-sunshine counsumer lanka ltd-x-tra#3.png
202501,1,133671142,19738010001,1736408005170,9,MALIBAN MILK PRODUCT (PVT) LTD,MALIBAN,MALIBAN/200/GM/CD BOX/FULL CREAM POWDER SAVE RS 30,530,200GM,CDBOX,,1737796234797-sunshine counsumer lanka ltd-x-tra#3.png
202501,1,8153997,14562010001,1737438770230,9,MALIBAN MILK PRODUCT (PVT) LTD,MALIBAN,MALIBAN/200/GM/CDBOX/FULL CREAM MILK POWDER + SAVE RS.20/,530,200 GM,"CDBOX ",,1737796234797-sunshine counsumer lanka ltd-x-tra#3.png
202501,4,251235,62402040011,1737783064124,3,KEELLS FOOD PRODUCTS LTD,KREST,KEELLS KREST/270/GM/CDBOX/FISH CUTLET,660,270 GM,CDBOX,,1737783064124-keells food products ltd-krest#3.png
202501,1,42724918,12209010004,1737452326426,30,NATURE'S BEAUTY CREATIONS LTD,PANDA BABY,PANDA BABY HERBAL COLOGNE NEEM&TURMERIC/100/ML/CD BOX,570,100ML,CD BOX,,1737452326426-nature-s beauty creations ltd-panda baby#3.png
202501,1,132816591,12524010001,1737695205217,16,GREEN LANKA COSMETICS CO.,SUDUMAL,SUDUMAL/160/G/EWRPK/DETERGENT BAR YELLOW,80,160G,"EWRPK ",,1737695205217-green lanka cosmetics co--sudumal#3.png
202501,1,132816591,12524010001,1737695629346,16,GREEN LANKA COSMETICS CO.,SUDUMAL,SUDUMAL/160/G/EWRPK/DETERGENT BAR ROSE,80,160G,"EWRPK ",,1737695629346-green lanka cosmetics co--sudumal#3.png
202501,1,116420583,62301010020,1737710523549,6,USWATTE GOLDEN BISCUITS (PVT)LTD,"USWATTE ",USWATTE KRISPIES VANILLA FLAVORED WAFERS 200GM,280,200GM,PLPCH,,1737710523549-uswatte golden biscuits -pvt-ltd-uswatte #3.png
202501,1,116620119,31201010029,1737708139151,21,FLASH DETERGENT (PVT) LTD,FLASH,FLASH/600/ML/PB0T/TOILET BOWL CLEANER,385,600ML,PBOT,,1737708139151-flash detergent -pvt- ltd-flash#3.png
202501,1,116620119,31201010029,1737708677961,21,FLASH DETERGENT (PVT) LTD,FLASH,FLASH/1000/ML/PBOT/FLORAL DISINFECTANT FLOOR CLEANER,470,1000ML,PBOT,,1737708677961-flash detergent -pvt- ltd-flash#3.png
202501,1,559871,18724010005,1737698716101,45,MANCHANAYAKA AGRI FOOD (PVT) LTD,COLO COCONUT MILK POWDER,"COLO/25/G/PLPSH/COCONUT MILK POWDER ",75,25G,"PLPSH ",,1737698716101-manchanayaka agri food -pvt- ltd-colo coconut milk powder#3.png
202501,1,559871,18724010005,1737698952723,12,WIJAYA PRODUCTS (PVT) LTD,WIJAYA,WIJAYA/20/G/PLPSH/PURE CEYLON TEA,60,20G,"PLPSH ",,1737698952723-wijaya products -pvt- ltd-wijaya#3.png
202501,1,17774550,14319010001,1737546373620,13,RECKITT BENCKISER (LANKA) LTD,DETTOL,"DETTOL COOL UP TO ANTIBACTERIAL COOLING SENSATION /1NO/EWPRK/70G BUY 4 GET 1 FREE HARPIC POWER PLUS 10X 200ML ",540,1NO,"EWPRK ",,1737546373620-reckitt benckiser -lanka- ltd-dettol#3.png
202501,1,116421126,81301010014,1737694499250,13,HEMAS MARKETING,VELVET,VELVET/70/GM/EWRPK/CUTIE ROSE & DRAGON FRUIT SOAP/SAVE RS 40,85,70GM,"EWRPK ",,1737694499250-hemas marketing-velvet#3.png
202501,1,116421126,81301010014,1737694842218,13,HEMAS MARKETING,VELVET,VELVET/70/GM/EWRPK/NATURALS COCONUT MILK & SHEA BUTTER SOAP/SAVE RS 40,85,70GM,"EWRPK ",,1737694842218-hemas marketing-velvet#3.png
202501,1,116421126,81301010014,1737697964415,10,JEEWAKA FOOD (PVT) LTD,JEEWAKA,"JEEWAKA/50/GM/PLPCH/FISH FLAVOUR SOYA MEAT ",100,50GM,"PLPCH ",,1737697964415-jeewaka food -pvt- ltd-jeewaka#3.png
202501,1,116421126,81301010014,1737694981947,13,HEMAS MARKETING,VELVET,VELVET/70/GM/EWRPK/NATURALS AVOCADO & ARGAN OIL SOAP/SAVE RS 40,85,70GM,"EWRPK ",,1737694981947-hemas marketing-velvet#3.png
202501,1,116421126,81301010014,1737699573586,10,JEEWAKA FOOD (PVT) LTD,JEEWAKA,"JEEWAKA/50/GM/PLPCH/CUTTLEFISH FLAVOUR SOYA MEAT ",100,50GM,"PLPCH ",,1737699573586-jeewaka food -pvt- ltd-jeewaka#3.png
202501,1,8159086,17801010001,1737615147188,24,NESTLE LANKA,MAGGI,"MAGGI/75 GM/PAPARE BLAST/PLPCH ",120,75 GM,"PLPCH ",,1737615147188-nestle lanka-maggi#3.png
202501,1,111619335,14728010001,1737539881174,13,TRADEX INDUSTRIAL PARK,OMIL,"OMIL / KOHOMBA / 100GM / WITH COCONUT & NEEM OIL / CDBOX ",135,100GM,CDBOX,New SKU,1737539881174-tradex industrial park-omil#3.png
202501,1,792884,19766010001,1737611548797,12,UDARATA TEA STORES,"JANATHA ",JANATHA TEA 40 GM,70,40 GM,PLPCH,,1737611548797-udarata tea stores-janatha #3.png
202501,2,792887,19766020001,1737607470959,2,SAJA FRUIT CANNERIES,"SAJA ",SAJA WOODAPPLE DRINK-PET 350 ML,200,350 ML,PET,,1737607470959-saja fruit canneries-saja #3.png
202501,2,792887,19766020001,1737607269700,2,SAJA FRUIT CANNERIES,"SAJA ",SAJA MANGO-PET 350 ML,200,350 ML,PET,,1737607269700-saja fruit canneries-saja #3.png
202501,1,131554204,13426010005,1737355380328,6,MALIBAN BISCUIT MANUFACTORIES,MALIBAN CREAM CRACKER FAMILY PAC,MALIBAN/CREAM CRACKER FAMILY PAC/490/G/PLPCH/SAVE RS 60,420,490,PLPCH,,1737607269700-saja fruit canneries-saja #3.png
202501,2,113829731,61402020013,1737617563198,2,WEERASINHA HOLDING (PVT) LTD,WINDAY GORAKA,WINDAY/NATURAL/GORAKA/DRINK/200 ML/RGB,150,200 ML,GLBOT,,1737617563198-weerasinha holding -pvt- ltd-winday goraka#3.png
202501,1,131554247,13426010002,1737355380328,6,MALIBAN BISCUIT MANUFACTORIES,MALIBAN CREAM CRACKER FAMILY PAC,MALIBAN/CREAM CRACKER FAMILY PAC/490/G/PLPCH/SAVE RS 60,420,490,PLPCH,,1737617563198-weerasinha holding -pvt- ltd-winday goraka#3.png
202501,1,119015661,14320010003,1736920404899,24,NES,MAGGI,"MAGGI /75/GM/PLPCH/PAPARE BLAST NOODLES ",0,"75GM ","PLPCH ",,1736920404899-nes-maggi#3.png
202501,1,119015661,14320010003,1737704546587,13,HEMAS MARKETING,BABY CHERAMY,BABY CHERAMY/75×5/GM/CDBOX /ALMOND OIL AND VITAMIN E SOAP +BABY CHERAMY 75 GM SOAP FREE,680,"375GM ","CDBOX ",,1737704546587-hemas marketing-baby cheramy#3.png
202501,1,110083193,14655010005,1737692279502,39,DUMINDU INDUSTRIES AND PRINTERS PVT LTD,WRITE,WRITE / 40 / PGS / 1 NO / CR BOOK,90,40 PGS,1 NO,Any other reason,1737692279502-dumindu industries and printers pvt ltd-write#3.png
202501,1,56151135,14060010001,1737690838020,39,PRINT EXCEL PVT LTD,RATHNA,RATHNA/200/PGS/A4 EXERCISE BOOK,520,200PGS,,,1737690838020-print excel pvt ltd-rathna#3.png
202501,1,120547453,11673010001,1737381931607,6,CEYLON BISCUITS LIMITED,MUNCHEE SUPER CREAM CRACKER,MUNCHEE/490/GM/SUPER CREAM CRACKER ENRICHED WITH VITAMINS + PRICE OFF RS 60,420,"490 GM ",PL POUCH,,1737690838020-print excel pvt ltd-rathna#3.png
202501,1,60595067,20644010001,1737696715894,28,DIMUTHU PRODUCTS,DIMUTHU,"DIMUTHU/25/GM/PLPCH/CINNAMON POWDER ",0,25GM,PLPCH,Delete the Item,1737696715894-dimuthu products-dimuthu#3.png
202501,1,8154039,14562010007,1737615829073,33,CAVINKARE PRIVATE LIMITED,INDICA,"INDICA/21/ML/PLPCH/EASY HAIR COLOUR LIQUID NATURAL BLACK + BUY 2 INDICA EASY GET 1 40ML MEERA CONDITIONER FREE ",195,21 ML,"PLPCH ",,1737615829073-cavinkare private limited-indica#3.png
202501,1,8154039,14562010007,1737620069817,30,VINI CONSUMER CARE LANKA PVT LTD,FOGG,FOGG/120/ML/TIN/DELICIOUS FRAGRANT BODY SPRAY FOR WOMEN,1490,120 ML,"TIN ",,1737620069817-vini consumer care lanka pvt ltd-fogg#3.png
202501,1,8154039,14562010007,1737698362787,26,ACE HEALTHCARE PVT LTD,SWABHA CEYLON,SWABHA CEYLON/180/ML/PLBOT/LONG AND STRONG CONDITIONER HIBISCUS JATAMANSI,585,180 ML,"PLBOT ",,1737698362787-ace healthcare pvt ltd-swabha ceylon#3.png
202501,1,8154039,14562010007,1737698195049,26,ACE HEALTHCARE PVT LTD,SWABHA CEYLON,SWABHA CEYLON/80/ML/PLBOT/LONG AND STRONG CONDITIONER HIBISCUS JATAMANSI,325,80 ML,"PLBOT ",,1737698195049-ace healthcare pvt ltd-swabha ceylon#3.png
202501,1,8154039,14562010007,1737611937090,26,UNILEVER SRI LANKA LTD,LIFEBUOY,LIFEBUOY/175/ML/PLBOT/HERBAL SHAMPOO WITH HERBAL EXTRACTS,520,175 ML,"PLBOT ",,1737611937090-unilever sri lanka ltd-lifebuoy#3.png
202501,1,8154039,14562010007,1737622398797,23,HEMAS PHARMACEUTICALS (PVT) LTD,SUSTAGEN,SUSTAGEN/400/GM/TIN/CHOCOLATE FLAVORED NUTRITIONAL SUPPLEMENT + FREE LIPTON/40/GM/CDBOX/YELLOW LABEL BLACK TEA,3900,400 GM,"TIN ",,1737622398797-hemas pharmaceuticals -pvt- ltd-sustagen#3.png
202501,1,8154039,14562010007,1737622028148,23,HEMAS PHARMACEUTICALS (PVT) LTD,SUSTAGEN,SUSTAGEN/400/GM/TIN/VANILLA FLAVORED NUTRITIONAL SUPPLEMENT + FREE LIPTON/40/GM/CDBOX/YELLOW LABEL BLACK TEA,3900,400 GM,"TIN ",,1737622028148-hemas pharmaceuticals -pvt- ltd-sustagen#3.png
202501,1,8154039,14562010007,1737620368209,30,VINI CONSUMER CARE LANKA PVT LTD,FOGG,FOGG/120/ML/TIN/PARADISE FRAGRANT BODY SPRAY FOR WOMEN,1850,120 ML,"TIN ",,1737620368209-vini consumer care lanka pvt ltd-fogg#3.png
202501,1,8166044,20643010001,1737442131035,25,HEMAS MARKETING,FEMS,FEMS/10 SANAKIN/3X PROTECTION /,270,10,"POCH ",,1737620368209-vini consumer care lanka pvt ltd-fogg#3.png
202501,1,8166044,20643010001,1737442317661,25,HEMAS MARKETING,"FEMS ","FEMS/10 NAPKIN/DRYTEX 3X PROTECTION ",270,10 NAPKINS,"POCH ",,1737620368209-vini consumer care lanka pvt ltd-fogg#3.png
202501,1,8166044,20643010001,1737698361450,10,SEWWANDI FOOD FRODUT,"SEWWANDI ",SEWWANDI/60G/POCH PACK /DADAYAM BATTA,100,60G,"POCH ",,1737698361450-sewwandi food frodut-sewwandi #3.png
202501,1,8166044,20643010001,1737698583909,10,SEWWANDI FOOD FRODUT,"SEWWANDI ",SEWWANDI /60G/POCH PACK /DALLO BATTA,100,60G,"POCH ",,1737698583909-sewwandi food frodut-sewwandi #3.png
202501,1,116071750,20261010001,1737173027634,9,PELWATTE DAIRY INDUSTRIES (PVT) LTD,PELWATTE,PELWATTE/200/GM/PLPCH/FULL CREAM MILK POWDER,540,200 GM,"PLPCH ",,1737698583909-sewwandi food frodut-sewwandi #3.png
202501,1,8152004,13118010001,1737355380328,6,MALIBAN BISCUIT MANUFACTORIES,MALIBAN CREAM CRACKER FAMILY PAC,MALIBAN/CREAM CRACKER FAMILY PAC/490/G/PLPCH/SAVE RS 60,420,490,PLPCH,,1737698583909-sewwandi food frodut-sewwandi #3.png
202501,1,8165103,71301010004,1736584130052,6,MALIBAN BISCUIT MANUFACTORIES,"MALIBAN ",MALIBAN/490/G/PLPCH/CREAM CRACKER SAVE 60,420,490G,"PLPCH ",,1737698583909-sewwandi food frodut-sewwandi #3.png
202501,1,39315178,12103010002,1737615687973,24,NESTLE LANKA,MAGGI,"MAGGI/75/GM/PLPCH/PAPARE BLAST INSTANT NOODLES ",120,75 GM,PLPCH,,1737615687973-nestle lanka-maggi#3.png
202501,1,41462479,12401010003,1736393251265,26,UNILEVER SRI LANKA LTD,LIFEBUOY,LIFEBUOY AYURVEDA CARE/ PANCHARATNA SHAMPOO/ 80ML / FREE LIFEBUOY MILD CARE WITH MILK PROTEIN/ 75GM,340,80ML,PBT,,1737615687973-nestle lanka-maggi#3.png
202501,2,114633822,13572020001,1737615423932,2,COCA-COLA BEVERAGES,FANTA ORANGE,FANTA\1500\ML\PBT\ORANGE FLAVOURED\SAVE RS 40,360,1500ML,PBT,,1737615423932-coca-cola beverages-fanta orange#3.png
202501,1,784449,18724010004,1737613367589,24,KITCHI HOLDING LANKA PVT LTD,KITCHI,KITCHI/400/G/PLPSH/INSTANT NOODLES/WITH FREE BIRIANI MIX SPICY PACK 2IN1,260,400G,"PLPSH ",,1737613367589-kitchi holding lanka pvt ltd-kitchi#3.png
202501,1,110008017,92401010005,1737092273972,39,B.S.T.TRADERS,ROSETTE,"ROSETTE/200/PGS/JAFFNA RULE ",300,200PGS,PGS,,1737613367589-kitchi holding lanka pvt ltd-kitchi#3.png
202501,1,134836367,21090010001,1737611630827,16,THILOKA ENTERPRISES,SNOLIGHT,SNOLIGHT/100/GM/EWRPK/LEMON PURE LAUNDRY BAR SOAP/THILOKA ENTERPRISES,80,100 GM,"EWRPK ",,1737611630827-thiloka enterprises-snolight#3.png
202501,1,86742750,20285010001,1737611200551,25,DREAM LIFE SCIENCE (PVT)LTD,ARYA,ARYA/8 PAD/POCH PACK /EASY NAPKIN,150,8,"POCH ",,1737611200551-dream life science -pvt-ltd-arya#3.png
202501,1,9010491,17724010001,1737620484246,21,MAKING HOLDING LANKA PVT LTD,SURE,SURE/250/ML/PBT/NO-1/LIME,250,250ML,PBT,,1737620484246-making holding lanka pvt ltd-sure#3.png
202501,1,9010491,17724010001,1737619716934,43,LION FRUIT PRODUCT (PVT),LION,"LION/185/ML/PBT/NO-1/TOMATO SAUCE ",240,185ML,PBT,,1737619716934-lion fruit product -pvt--lion#3.png
202501,1,9010491,17724010001,1737620845918,28,"DINIDU PRODUCTS ",DINIDU,DINIDU/50/G/EWRPK/NO-1/CHILLI PIECES,80,50G,EWRPK,,1737620845918-dinidu products -dinidu#3.png
202501,1,9010491,17724010001,1737620728453,28,"DINIDU PRODUCTS ",DINIDU,"DINIDU/50/G/EWRPK/NO-1/CHILLI POWDER ",80,50G,EWRPK,,1737620728453-dinidu products -dinidu#3.png
202501,2,9010491,17724020001,1737612923819,2,CEYLON COLD STORES,ELEPHANT HOUSE VIBE,ELEPHANT HOUSE VIBE /250/ML/CAN/NO-1/GRAPE BURST,150,250ML,CAN,,1737620728453-dinidu products -dinidu#3.png
202501,2,9010491,17724020001,1737613112180,2,CEYLON COLD STORES,ELEPHANT HOUSE VIBE,ELEPHANT HOUSE VIBE/250/ML/CAN/NO-1/APPLE BURST,150,250ML,CAN,,1737620728453-dinidu products -dinidu#3.png
202501,2,8160562,18670020001,1737612923819,2,CEYLON COLD STORES,ELEPHANT HOUSE VIBE,ELEPHANT HOUSE VIBE /250/ML/CAN/NO-1/GRAPE BURST,150,250ML,CAN,,1737612923819-ceylon cold stores-elephant house vibe#3.png
202501,2,8160562,18670020001,1737613112180,2,CEYLON COLD STORES,ELEPHANT HOUSE VIBE,ELEPHANT HOUSE VIBE/250/ML/CAN/NO-1/APPLE BURST,150,250ML,CAN,,1737613112180-ceylon cold stores-elephant house vibe#2.png
202501,1,79126872,17896010001,1737608074960,12,GAMUNU PRODUCTS PVT,"GAMUNU ",GEMUNU/50/G/EWRPK/NO-1/TEA,90,50G,EWRPK,,1737608074960-gamunu products pvt-gamunu #3.png
202501,1,112787347,13722010006,1737622662533,13,HEMAS MARKETING,BABY CHERAMY,"BABY CHERAMY/225(75G×3)/GM/CDB/FLORAL EXTRACTS, VITAMIN E & MILK/SAVE RS. 50/=",385,225GM(75G×3),CDB,,1737622662533-hemas marketing-baby cheramy#3.png
202501,2,111681224,31201020011,1737616203114,2,LANKA KINGS FOOD (PVT) LTD,KINGS KAL KIRI,"KINGS KAL KIRI/250/ML/GBT/CHOCOLATE FLAVOURED ",150,"250ML ",GBT,,1737616203114-lanka kings food -pvt- ltd-kings kal kiri#3.png
202501,1,111681224,31201010001,1737607092217,11,COUNTRY STYLE FOODS,FND,FND/55/GM/PLPCH/JUJUBS,100,55GM,"PLPCH ",,1737607092217-country style foods-fnd#3.png
202501,1,111681224,31201010001,1737608626965,9,PURE DALE CEYLON (PVT) LTD,PUREDALE,PUREDALE/1000/GM/CDBOX/FULL CREAM MILK POWDER,2625,1000GM,CDBOX,,1737608626965-pure dale ceylon -pvt- ltd-puredale#3.png
202501,1,111681224,31201010001,1737609423437,39,NARAH COMPUTER FORMS,TEN,TEN/1/NO/DRAWING BOOK WHITE MEDIUM 40 PGS,140,1NO,,,1737609423437-narah computer forms-ten#3.png
202501,5,11570,73050016,1737607327771,38,NC PAINT,NIL MANEL,"NIL MANEL/375ML/GBT/NC THINNER ",440,375ML,GBT,,1737607327771-nc paint-nil manel#3.png
202501,5,11570,73050016,1737607636997,38,NC PAINT,NIL MANEL,"NIL MANEL/180ML/GBT/NC THINNER ",220,180ML,GBT,,1737607636997-nc paint-nil manel#3.png
202501,1,41183329,13101010007,1737354205125,6,CEYLON BISCUITS LIMITED,MUNCHEE SUPER CREAM CRACKER,MUNCHEE\490\G\EWRPK \SUPER CREAM CRACKER SAVE R.S 60,420,490G,"EWRPK ",,1737607636997-nc paint-nil manel#3.png
202501,1,41183329,13101010007,1736833825528,6,MALIBAN BISCUIT MANUFACTORIES,"MALIBAN CREAM CRACKER ",MALIBAN\490\G\PLPCH \CREAM CRACKER FAMILY PACK SAVE R.S 60,420,490G,"PLPCH ",,1737607636997-nc paint-nil manel#3.png
202501,1,133669291,22302010005,1737616183473,24,NESTLE LANKA,MAGGI,"MAGGI/75/GM/PLPCH/PAPARE BLAST/INSTANT NOODLES ",120,75MG,PLPCH,,1737616183473-nestle lanka-maggi#3.png
202501,1,35551208,51101010010,1737529894493,24,NESTLE LANKA,MAGGI,MAGGI/75/G/PLUPCH/PAPARE BLAST,120,75G,PLUPCH,,1737529894493-nestle lanka-maggi#3.png
202501,1,40855428,12103090003,1737092331950,39,THIAGI ASSOCIATES,MYPAL,MYPAL/40/GM/PBT/BINDER GLUE PEN STIK IT,150,40 GM,PBT,,1737529894493-nestle lanka-maggi#3.png
202501,1,1700664,18181010001,1737615488237,15,ANTLER INDUSTRIES (PVT) LTD,AROMA,BRITOL/AROMA/1000/GM/PLPCH/SHAKTHI/DETERGENT POWDER/FRESH FLORAL,279,1000 GM,PLPCH,,1737615488237-antler industries -pvt- ltd-aroma#3.png
202501,2,131555132,14321020004,1737610951177,2,CEYLON COLD STORES,"ELEPHANT HOUSE ",ELEPHANT HOUSE/250/ML/CAN/VIBE APPLE BURST,150,"250ML ",CAN,,1737610951177-ceylon cold stores-elephant house #3.png
202501,1,131555132,14321010001,1737608838120,12,TN PRODUCT,KADU MEDAL TEA,"KADU MEDA TEA/50/GM/PLPCH/BOPF TEA/ TN PRODUCTS ",95,"50GM ","PLPCH ",,1737608838120-tn product-kadu medal tea#3.png
202501,1,131555170,14321010004,1737452297203,26,NATURE'S BEAUTY CREATIONS LTD,PANDA BABY,"PANDA BABY/50/ML/PBT/NELLI AND NEEM SHAMPOO ",150,50ML,PBT,,1737452297203-nature-s beauty creations ltd-panda baby#3.png
202501,1,131555170,14321010004,1737452211377,30,NATURE'S BEAUTY CREATIONS LTD,PANDA BABY,"PANDA BABY/50/ML/PBT/HAPPY SMILE BABY COLOGNE ",280,50ML,PBT,,1737452211377-nature-s beauty creations ltd-panda baby#3.png
202501,1,131555170,14321010004,1737447723760,19,UNILEVER SRI LANKA LTD,VASELINE INTENSIVE CARE,VASELINE/400/ML/PBT/DEEP RESTORE +PONDS SUPER LIGHT 25 GM FREE,2160,400ML,PBT,,1737447723760-unilever sri lanka ltd-vaseline intensive care#3.png
202501,1,131555170,14321010004,1737520988763,9,MALIBAN MILK PRODUCT (PVT) LTD,MALIBAN,MALIBAN/200/GM/CDBOX/FULL CREAM MILK POWDER 20 RS SAVE,530,"200GM ","CDBOX ",,1737520988763-maliban milk product -pvt- ltd-maliban#3.png
202501,1,131555170,14321010004,1737449059211,19,C.W. MACKIE PLC,HIMALAYA,"HIMALAYA/50/GM/CDBOX/REVITALISING NIGHT CREAM ",1535,50GM,"CDBOX ",,1737449059211-c-w- mackie plc-himalaya#3.png
202501,1,131555170,14321010004,1737522872999,6,MALIBAN BISCUIT MANUFACTORIES,MALIBAN LEMON PUFF,MALIBAN /100/GM/LEMON PUFF SUGAR LESS 30%,150,100GM,"PLPCH ",,1737522872999-maliban biscuit manufactories-maliban lemon puff#3.png
202501,1,131555170,14321010004,1737452530039,26,NATURE'S BEAUTY CREATIONS LTD,PANDA BABY,"PANDA BABY/200/ML/PBT/NELLI AND NEEM SHAMPOO ",490,200ML,PBT,,1737452530039-nature-s beauty creations ltd-panda baby#3.png
202501,1,131555170,14321010004,1737451987417,30,NATURE'S BEAUTY CREATIONS LTD,PANDA BABY,"PANDA BABY/50/ML/CDBOX/HERBAL COLOGNE NEEM AND TURMERIC ",360,50ML,"CDBOX ",,1737451987417-nature-s beauty creations ltd-panda baby#3.png
202501,1,131555170,14321010004,1737448616980,19,UNILEVER SRI LANKA LTD,FAIR & LOVELY,"FAIR AND LOVELY/50/GM/ GLOW AND LOVELY POWDER FINISH CREAM ",880,50GM,"CDBOX ",,1737448616980-unilever sri lanka ltd-fair - lovely#3.png
202501,1,131555170,14321010004,1737452066559,30,NATURE'S BEAUTY CREATIONS LTD,PANDA BABY,"PANDA BABY/100/ML/CDBOX/HERBAL COLOGNE NEEM AND TURMERIC ",570,100ML,"CDBOX ",,1737452066559-nature-s beauty creations ltd-panda baby#3.png
202501,1,131555170,14321010004,1737522624385,6,MALIBAN BISCUIT MANUFACTORIES,MALIBAN GINGER,MALIBAN/80/GM/PLPCH/GINGER BISCUITS SUGAR LESS 30%,135,80GM,"PLPCH ",,1737522624385-maliban biscuit manufactories-maliban ginger#3.png
202501,1,131555170,14321010004,1737447504299,27,UNILEVER SRI LANKA LTD,CLOSE UP,CLOSEUP/120/GM/CDBOX/EVER FRESH PEPPERMINT SPLASH 90 RS SAVE,320,120GM,"CDBOX ",,1737447504299-unilever sri lanka ltd-close up#3.png
202501,1,131555170,14321010004,1737447590908,27,UNILEVER SRI LANKA LTD,CLOSE UP,"CLOSEUP/120/GM/CDBOX/CLOVE +ORANGE 90 RS SAVE ",320,120GM,"CDBOX ",,1737447590908-unilever sri lanka ltd-close up#3.png
202501,1,131555170,14321010004,1737448072785,19,UNILEVER SRI LANKA LTD,VASELINE INTENSIVE CARE,VASELINE/200/ML/PBT/COCOA GLOW INTENSIVE CARE+ PONDS SUPER LIGHT GEL 25GM FREE,1315,200ML,PBT,,1737448072785-unilever sri lanka ltd-vaseline intensive care#3.png
202501,1,131555170,14321010004,1737447917621,19,UNILEVER SRI LANKA LTD,VASELINE INTENSIVE CARE,VASELINE/200/ML/PBT/DERMA CARE ADVANCED REPAIR BODY LOTION +PONDS SUPER LIGHT GEL 24.5GM FREE,1585,200ML,PBT,,1737447917621-unilever sri lanka ltd-vaseline intensive care#3.png
202501,1,131555170,14321010004,1737522748347,6,MALIBAN BISCUIT MANUFACTORIES,MALIBAN REAL CHOCOLATE CREAM,MALIBAN/100/GM/PLPCH/REAL CHOCOLATE CREAM SUGAR LESS 30%,150,100GM,"PLPCH ",,1737522748347-maliban biscuit manufactories-maliban real chocolate cream#3.png
202501,1,131555170,14321010004,1737452154383,30,NATURE'S BEAUTY CREATIONS LTD,PANDA BABY,"PANDA BABY/100/ML/PBT/HAPPY SMILE BABY COLOGNE ",500,100ML,PBT,,1737452154383-nature-s beauty creations ltd-panda baby#3.png
202501,1,131555170,14321010004,1737452441453,26,NATURE'S BEAUTY CREATIONS LTD,PANDA BABY,"PANDA BABY/100/ML/PBT/NELLI AND NEEM SHAMPOO ",280,100ML,PBT,,1737452441453-nature-s beauty creations ltd-panda baby#3.png
202501,1,131555170,14321010004,1737448844366,19,UNILEVER SRI LANKA LTD,FAIR & HANDSOME,FAIR AND LOVELY MENS/50/GM/CDBOX/GLOW AND HANDSOME RAPID ACTION CREAM+AXE TICKET DE0 17 ML FREE,1055,50GM,"CDBOX ",,1737448844366-unilever sri lanka ltd-fair - handsome#3.png
202501,5,12129,88050007,1737628331563,36,DECORATIVE TOOLS & BRUSHES (PVT) LTD,E-ZY,E-ZY BRUSH/9/INCH/PLPCH/E-ZY ROLLER FOR USE WUTH EMULSION PAINT.,780,9'INCH,PLPCH,,1737628331563-decorative tools - brushes -pvt- ltd-e-zy#3.png
202501,2,37139170,11101020118,1736401479952,2,"CARGILLS FOOD & BEVERAGE LIMITED ","KIST SPARKLING APPLE ","KIST SPARKLING APPLE FLAVOURED DRINK/250ML/CAN ",180,250ML,CAN,,1737628331563-decorative tools - brushes -pvt- ltd-e-zy#3.png
202501,2,37139170,11101020118,1736401027553,2,"CARGILLS FOOD & BEVERAGE LIMITED ",KIST SPARKLING STRAWBERRY,KIST SPARKLING STRAWBERRY FLAVOURED DRINK/250ML/CAN,180,250ML,CAN,,1737628331563-decorative tools - brushes -pvt- ltd-e-zy#3.png
202501,2,37139170,11101020118,1736401322821,2,"CARGILLS FOOD & BEVERAGE LIMITED ",KIST SPARKLING ORANGE,"KIST SPARKLING ORANGE FLAVOURED DRINK/250ML/CAN ",180,250ML,CAN,,1737628331563-decorative tools - brushes -pvt- ltd-e-zy#3.png
202501,5,10844,13050007,1737618297583,37,MAYURA COLOR PAINTS LANKA,MULTICO,"MULTICO/10/L/BUCKET/ BRILLIANT WHITE WEATHERSHADE FOR EXTERIOR ",26830,10 L,BUCKET,,1737618297583-mayura color paints lanka-multico#3.png
202501,5,10844,13050007,1737619696813,37,MAYURA COLOR PAINTS LANKA,MULTICO,"MULTICO/1/L/BRILLIANT WHITE WEATHERSHADE FOR EXTERIOR ",2860,1 L,"BUCKET ",,1737619696813-mayura color paints lanka-multico#3.png
202501,5,10844,13050007,1737618509962,37,MAYURA COLOR PAINTS LANKA,MULTICO,"MULTICO/20/L/BUCKET/BRILLIANT WHITE WEATHERSHADE FOR EXTERIOR ",52465,20 L,"BUCKET ",,1737618509962-mayura color paints lanka-multico#3.png
202501,5,12583,951050001,1737609247844,37,OZONE COATINGS (PVT) LTD,OZONE,OZONE/4/L/BUCKET/EMULSION/BRILLIANT WHITE/INTERIOR,6240,4 L,"BUCKET ",New SKU,1737609247844-ozone coatings -pvt- ltd-ozone#3.png
202501,2,8164601,20583020009,1737616618321,2,COCA-COLA BEVERAGES,COCA-COLA,"COCA -COLA/1500/ML/PBT SAVE AS 40 RS ",360,1500ML,PBT,,1737616618321-coca-cola beverages-coca-cola#3.png
202501,2,8164601,20583020009,1737616865549,2,COCA-COLA BEVERAGES,FANTA ORANGE,FANTA/1500/ML/PBT/ORANGE FLAVOURED SAVE AS 40 RS,360,1500ML,PBT,,1737616865549-coca-cola beverages-fanta orange#3.png
202501,1,79955141,20526010001,1737618710047,11,CROWN SWEETY PRODUCTS PVT LTD,CROWN,CROWN/25/GM/PLPCH/LOLLYPOP,50,25ML,PLPCH,,1737618710047-crown sweety products pvt ltd-crown#3.png
202501,2,82785811,11101020014,1737604759224,2,DESSERT BITES,CHILLER MIXED FRUIT,CHILLER/MIXED FRUIT FLAVORED DRINK/500/ML/PET,200,500ML,PET,,1737604759224-dessert bites-chiller mixed fruit#3.png
202501,2,82785811,11101020014,1737604856425,2,DESSERT BITES,CHILLER MIXED FRUIT,CHILLER/MANGO FLAVOURED DRINK/500/ML/PET,200,500ML,PET,,1737604856425-dessert bites-chiller mixed fruit#3.png
202501,5,10213,89050001,1737611738893,38,CRYSTAL ENTERPRISES,WINLAC NC THINNER,"WINLAC/1/LTR/PLCAN/ WINLAC AUTO SHINE HIGH GLOSS N.C THINNER ",1120,1LTR,"PLCAN ",,1737611738893-crystal enterprises-winlac nc thinner#3.png
